question,answer,docid,dataType,title,content
人魚症候羣的患者具有哪些共同特徵？,根據原文“人魚症候羣的患者是食人癖者中最爲特殊的族羣，他們喫人，不過理由相當奇怪--他們都說自己喫的是魚，而且相當一部分的人說自己喫的是人魚。於是有學者開始研究，他們發現那些人有共同特徵，那就是他們幾乎都是某次海難之後的倖存者。”可知，人魚症候羣的患者具有食人癖，並且幾乎都是某次海難之後的倖存者。,245548,百科,人魚症候羣,出現於月下桑的7 truth系列《亡者日記》第八章。人魚症候羣，也叫食人情結，是食人癖的一種。有些人喜歡喫人肉，心理學上管那些人叫做有食人癖的人，人魚症候羣的患者是食人癖者中最爲特殊的族羣，他們喫人，不過理由相當奇怪--他們都說自己喫的是魚，而且相當一部分的人說自己喫的是人魚。於是有學者開始研究，他們發現那些人有共同特徵，那就是他們幾乎都是某次海難之後的倖存者，這個巧合讓那個學者非常感興趣，於是繼續研究，然後發現了可悲的事實。（該症暫處於人爲虛構階段）。人魚症候羣亡者日記 海難是可怕的事情，雖然現在很少出現海難，可是一旦發生，後果往往很可怕，有人會在海難中直接死掉，還有人會留下來，留在船上，他們是倖存者，有時候他們可以維持到有人營救，成爲名符其實的倖存者。 可是有的時候......他們等不來。食物會一天天耗盡，體力也會一天天耗盡，人們在只有水沒有食物的情況下，極限是幾天呢？ 根據體力不同有所區別，不過大概是兩週左右，有的遇難者卻在沒有食物的情況下，維持了八個月等到有人營救。 他們喫掉了自己的同伴，他們靠喫人活下來。 你們知道人魚的傳說是怎麼流傳出來的麼？你們知道人魚的傳說起源是哪裏麼？ 是海員，確切的說是航海的人。大部分人說自己見到人魚是在海難的情況下...... “......人魚......是會帶來災難的生物，它們只在海難的時候纔出現......” 爲什麼......只在海難的時候纔有人魚的傳說呢？ 那些半身是人，半身是魚的生物......出現在海里，聽說它們會大聲的尖叫。 它們在尖叫什麼？警告災難麼？ 不...... 嘲笑人類麼？ 不...... 它們是在求助。 我想它們是在求助。 有一種更爲現實的理解，那些海里露出半身的生物，根本不是人魚！他們是人！是遇難的人！他們尖叫、他們掙扎、他們在等人營救！ 然而那些船上的人，爲了自身安全的問題不敢營救，所以他們說自己看到的是人魚。 多好的解釋？！ 人魚嘛......是會游泳的，根本不需要他們營救。 還有更加可悲的事情，海難中喫掉自己同伴活下來的人，因爲良心譴責，他們不肯承認自己喫掉的是人，幾乎像是統一口徑一樣，他們說他們喫的是人魚。 在他們心裏，人魚有着人類的部分骨骼，但是本質還是魚，魚嘛，就是食物，所以他們喫掉的原本就是食物。 這個就是人魚症候羣了。 （7 turth《亡者日記》裏 作者：月下桑） 人魚症候羣月下桑 著名《7 truth》、《亡靈書》系列的作者。
億利東方學校的老師素質如何？,根據原文“億利的年輕老師都是拿成績考進去的，取的是事業單位招聘考試各科目的前幾名！資質老一點的老師大多是其他各名校教的特別棒，學生家長都認同的老師。真材實料還是佔很大比例的！”可知，億利東方學校的老師素質非常高。年輕老師是通過成績考試進入學校，而資質老師大多來自其他名校，受到學生家長的認可。因此，學校的老師素質很高。,245832,百科,億利東方學校,億利東方學校是億利資源集團投資1.2億元新建的一所集幼兒園、小學、初中爲一體的高規格、高起點的現代化寄宿制學校。學校位於烏蘭察布市集寧區河東片區億利城，建築規模宏大，建築風格端莊典雅，整體佈局合理，育人環境優美。學校佔地面積9萬平方米，建築面積2.9萬平方米。學校現有教師120人，學生1100人，共有21個教學班，其中小學11個班，中學17個班。學校擁有校園網絡中心、校園電視臺、多功能報告廳、圖書室、閱覽室、語音室、音樂教室、美術教室、科技教室、勞技手工教室、計算機教室、舞蹈形體練功房以及理、化、生實驗室，教學設備和圖書資料一應俱全。每個教室都配置了先進的多媒體。擁有標準的400米塑膠跑道及草坪田徑運動場、足球場、籃球場、排球場、羽毛球場。師生食宿條件優良，高標準學生公寓，環境舒適。學校概況 集寧區億利東方學校是一所由億利資源集團捐建的政府公辦的重點實驗學校。九年一貫制的現代化學校億利東方學校，是一所集幼兒園、小學、初中爲一體的高規格現代化寄宿制學校。其教學意識超前，硬件建設屬國內一流水平，必將成爲烏蘭察布市高起點、高質量的現代化教學示範性學校！ 學校師資力量雄厚，現有市級以上名師、教學能手和學科帶頭人35人，高級職稱30人，中級職稱34人。學校設有初中教學班8個，小學教學班15個，幼兒園教學班7個，師生總數近1300人。 學校配套設施齊全。擁有校園網絡中心、校園電視臺、多功能報告廳、圖書室、閱覽室、語音室、音樂教室、美術教室、科技教室、勞技手工教室、計算機教室、舞蹈形體練功房以及理、化、生實驗室，教學設備和圖書資料齊備。 學校的辦學總目標是構建三主體教育模式，爭創中華一流名校，實現學生、教師、家長三體聯動，和諧提升。高效課堂、學生自主管理和家校合作三大載體不斷彰顯三主體教育特色，生態文明教育繼承發揚億利資源集團生態愛國的企業文化。我們相信，假以時日，億利東方學校必將成爲騰飛的烏蘭察布市的一顆璀璨的教育明珠！ 拓展信息 問：億利東方學校的老師好麼？素質怎麼樣？ 答：億利的年輕老師都是拿成績考進去的，取的是事業單位招聘考試各科目的前幾名！資質老一點的老師大多是其他各名校教的特別棒，學生家長都認同的老師。真材實料還是佔很大比例的！ 問：億利東方學校是不是一所貴族學校？收不收貧困生？ 答：這個學校是非盈利的，談不上貴族學校，大部分學生都是普通百姓。 所獲榮譽 2019年9月，獲得“全國教育系統先進集體”稱號。 [1]
億芭利公司的橄欖油品牌情況如何？,根據原文“億芭利公司1842年成立於西班牙安達盧西亞地區塞維利亞， 採用先進的工藝和嚴格的質量控制，生產味道獨特、優質的橄欖油，是橄欖油最大生產國和出口國西班牙的三大品牌之一。品牌情況 億芭利橄欖油也是西班牙心臟協會唯一推薦的橄欖油。”可知，億芭利公司的橄欖油是西班牙的三大品牌之一，具有獨特的味道和嚴格的質量控制，同時也是西班牙心臟協會唯一推薦的橄欖油。,246052,百科,億芭利,億芭利公司1842年成立於西班牙安達盧西亞地區塞維利亞， 採用先進的工藝和嚴格的質量控制，生產味道獨特、優質的橄欖油，是橄欖油最大生產國和出口國西班牙的三大品牌之一。品牌情況 億芭利橄欖油也是西班牙心臟協會唯一推薦的橄欖油。豐富的經驗， 高貴的品質，以及先進的工藝使億芭利橄欖油公司已成爲世界知名的橄欖油生產領導者，並被衆多客戶認爲是橄欖油的象徵。同時，億芭利還是西班牙最大的沙拉醬和橄欖的生產企業。 億芭利橄欖油於2001年進入中國市場，也是進入中國市場最早的橄欖油品牌之一。 [1] 產品優勢 西班牙心臟協會唯一推薦的橄欖油 橄欖油最大生產國和出口國西班牙的最大品牌之一 豐富的經驗，高貴的品質，以及先進的工藝使億芭利橄欖油公司已成爲世界知名的橄欖油生產領導者，並被衆多客戶認爲是橄欖油的象徵。同時，億芭利還是西班牙最大的沙拉醬和橄欖的生產企業。 [1] 混合橄欖油 億芭利混合橄欖油由20%特級初榨橄欖油和80%精煉橄欖油組成。 最高煙點高達240度，大大高於其它植物種子食用油，也高於特級初榨橄欖油的190度。 只能烹飪，不能生食。最大酸度：1%。 [1] （一）億芭利混合橄欖油（1L瓶裝） 商品名稱 億芭利混合橄欖油（1L瓶裝） 商品產地 西班牙 保質期限 24個月 商品規格 1L瓶 儲存方式 避光避高溫儲存 商品味道 無味或有淡淡的橄欖味道 商品顏色 淡綠色或黃綠色 配料 20%特級初榨橄欖油、80%精煉橄欖油 酸度 ≦1% 不飽和脂肪酸含量 75% （二）億芭利混合橄欖油（3L桶裝） 商品名稱 億芭利混合橄欖油（3L桶裝） 商品產地 西班牙 保質期限 24個月 商品規格 3L瓶 儲存方式 避光避高溫儲存 商品味道 無味或有淡淡的橄欖味道 商品顏色 淡綠色或黃綠色 配料 20%特級初榨橄欖油、80%精煉橄欖油 酸度 ≦1% 不飽和脂肪酸含量 75% 初榨橄欖油 由hojiblanca白葉品種， picual皮夸爾和arbequina阿爾貝基納製成 每100g中單不飽和脂肪酸含量 達到75g，最大酸度0.8%。 [1] （一）億芭利特選特級初榨橄欖油（750ml瓶裝） 商品名稱 億芭利特選特級初榨橄欖油（750ml瓶裝） 商品產地 西班牙 保質期限 24個月 商品規格 750ml瓶 儲存方式 避光避高溫儲存 商品味道 無味或有淡淡的橄欖味道 商品顏色 淡綠色或黃綠色 配料 100%特級初榨橄欖油 酸度 ≦0.8% 不飽和脂肪酸含量 75% 特級橄欖油 採用精選的白葉橄欖品種，口感柔和果香清新怡人，適合大衆口味。 採用新型國際上先進的壓榨工藝，避免了可能存在的污染，完全保留橄欖的天然營養成分。 每100g中單不飽和脂肪酸含量 達到75g，最大酸度0.5%。 口感柔和果香。 [1] （一）億芭利特級初榨橄欖油（250ml瓶裝） 商品名稱 億芭利特級初榨橄欖油（250ml瓶裝） 商品產地 西班牙 保質期限 24個月 商品規格 250ml瓶 儲存方式 避光避高溫儲存 商品味道 無味或有淡淡的橄欖味道 商品顏色 淡綠色或黃綠色 配料 100%特級初榨橄欖油 酸度 ≦0.5% 不飽和脂肪酸含量 75% （二）億芭利特級初榨橄欖油（500ml瓶裝） 商品名稱 億芭利特級初榨橄欖油（500ml瓶裝） 商品產地 西班牙 保質期限 24個月 商品規格 500ml瓶 儲存方式 避光避高溫儲存 商品味道 無味或有淡淡的橄欖味道 商品顏色 淡綠色或黃綠色 配料 100%特級初榨橄欖油 酸度 ≦0.5% 不飽和脂肪酸含量 75% （三）億芭利特級初榨橄欖油（750ml瓶裝） 商品名稱 億芭利特級初榨橄欖油（750ml瓶裝） 商品產地 西班牙 保質期限 24個月 商品規格 750ml瓶 儲存方式 避光避高溫儲存 商品味道 無味或有淡淡的橄欖味道 商品顏色 淡綠色或黃綠色 配料 100%特級初榨橄欖油 酸度 ≦0.5% 不飽和脂肪酸含量 75% （四）億芭利特級初榨橄欖油（1L瓶裝） 商品名稱 億芭利特級初榨橄欖油（1L瓶裝） 商品產地 西班牙 保質期限 24個月 商品規格 1L瓶 儲存方式 避光避高溫儲存 商品味道 無味或有淡淡的橄欖味道 商品顏色 淡綠色或黃綠色 配料 100%特級初榨橄欖油 酸度 ≦0.5% 不飽和脂肪酸含量 75% （五）億芭利特級初榨橄欖油（3L罐裝） 商品名稱 億芭利特級初榨橄欖油（3L罐裝） 商品產地 西班牙 保質期限 24個月 商品規格 3L罐 儲存方式 避光避高溫儲存 商品味道 無味或有淡淡的橄欖味道 商品顏色 淡綠色或黃綠色 配料 100%特級初榨橄欖油 酸度 ≦0.5% 不飽和脂肪酸含量 75%
《什麼是五行》應用的功能是什麼？,根據原文“通過這個心理測驗可以增加對自己的性格的瞭解。展現您的性格特色與社會兼容性。 元素測給您帶全所未有的精神體驗！ 測驗的基礎是心理研究，於是所有的結果有效。”可知，《什麼是五行》應用的功能是通過心理測驗增加對自己性格的瞭解，展現性格特色與社會兼容性，爲用戶帶來全新的精神體驗，其基礎是心理研究，因此所有結果有效。,246251,百科,什麼是五行,《什麼是五行》是一款Android平臺的應用。應用介紹 通過這個心理測驗可以增加對自己的性格的瞭解。展現您的性格特色與社會兼容性。 元素測給您帶全所未有的精神體驗！ 測驗的基礎是心理研究，於是所有的結果有效。 不知道怎麼分析人的性格嗎？立即下載《元素測驗》，這款軟件是完全免費的！知道您的性格屬於什麼元素：地、火、氣、水。每個元素的人物和行爲都有自己的特色！ 敢不敢開始自我分析嗎？深刻地研究自己！元素測驗是最有意思的剖析之一！ [1] 支持版本 2.3及以上固件版本
什張家鄉位於哪個地區？,根據原文“什張家鄉（Shi Zhang Jia Xiang） 位於西寧市湟中區境東南部”可知，什張家鄉位於西寧市湟中區境東南部。,246461,百科,什張家鄉,【什張家鄉（Shi Zhang Jia Xiang）】 位於西寧市湟中區境東南部，距區府駐地43千米。人口0.8萬，以漢族爲主，還有回族、土族。面積77平方千米。轄什張家下營、拉尕、什張家上營、窯洞、羣塔爾、過堂子、什張家陽坡、流水溝、黃蒿臺9個村委會。1949年沿舊制屬土門關鄉，1956年設什張家鄉，1958年爲小南川公社，1984年復設什張家鄉。 2001年1月16日青海省人民政府青政函[2001]7號文批覆：撤銷田家寨鄉和什張家鄉，合併設立田家寨鎮。
仁懦這個詞語指的是什麼？,根據原文“仁懦，是漢語詞彙，讀音是rén nuò，出自雞肋編。仁懦詞語信息 仁懦 rén nuò 仁懦詞語釋義 慈善懦弱。”可知，仁懦指的是慈善但懦弱的特徵。,247103,百科,仁懦,仁懦，是漢語詞彙，讀音是rén nuò，出自雞肋編。仁懦詞語信息 仁懦 rén nuò 仁懦詞語釋義 慈善懦弱。宋·莊季裕《雞肋編》捲上：“﹝唐太宗﹞既立晉王，又謂長孫無忌曰：‘公勸我立雉奴。雉奴仁懦，得無爲宗社憂，奈何！’”
少女爲什麼要復仇？,"根據原文“離開墨家住宅後無依無靠,只能相依相偎,轉眼就是十年。十年的風雨歷練,她們蛻變成了江湖上無人不曉的‘醫毒雙仙’,事情就這樣結束了嗎？不,她要復仇,她要讓十年前奪走她最愛的雙親的人付出應有的代價”可知，少女要復仇是因爲她在遭受了十年的風雨歷練後，決心要讓奪走她雙親的人付出應有的代價。",247493,百科,仇淚,"仇淚是一部小說，作者霧淚祈。小說類型 傳統武俠 內容簡介 原本幸福快樂的一家,卻在某年某日被血洗,倖免於難的只有那尚且年幼的女娃,還有年輕貌美的墨家奴婢,失去雙親的七歲墨氏女娃該何去何從？兩人離開墨家住宅後無依無靠,只能相依相偎,轉眼就是十年。十年的風雨歷練,她們蛻變成了江湖上無人不曉的“醫毒雙仙”,事情就這樣結束了嗎？不,她要復仇,她要讓十年前奪走她最愛的雙親的人付出應有的代價,十七歲的少女墜進復仇的深淵,但這樣做真的是對的嗎？少女遲疑了,她最後究竟會怎樣做？她的命運又是怎樣的呢？"
《今夜星空》這首歌曲的歌詞是由誰作詞和作曲的？,根據原文“今夜星空 演唱：高勝美 作詞：張尚喬 作曲：陳進興”可知，這首歌的歌詞是由張尚喬作詞，陳進興作曲。,247781,百科,今夜星空,《今夜星空》是高勝美演唱的歌曲，所屬專輯《第20張超級白金 [鐳射金曲14]》。今夜星空 演唱：高勝美 作詞：張尚喬 作曲：陳進興 早已不是輕易掉淚的年紀 也難以說出我是多麼捨不得你 只好趁着一陣晚風吹來 讓飄揚的長髮掩住心碎的嘆息 縱然不曾等待它也要來臨 愛情原就是一片善變的海洋 當我知道它已悄悄遠去 讓陣陣的浪潮掩住辛酸的哭泣 縱然雙眼已模糊 縱然雙眼已模糊 我凋零的心凋零的心 依然像午夜的天空 以千萬個眼睛 溫柔的送你遠去 縱然不曾等待 它也要來臨 愛情原就是一片善變的海洋 當我知道它已悄悄遠去 讓陣陣的浪潮掩住辛酸的哭泣 縱然雙眼已模糊 縱然雙眼已模糊 我凋零的心凋零的心 依然像午夜的天空 以千萬個眼睛 溫柔的送你遠去
電影《今天我回家》是關於什麼內容的？,根據原文“講述的一個農村家庭兒子外出工作，父母孤獨的在家裏時時刻刻的思念，天天盼望等候兒子的電話。”可知，《今天我回家》是關於一個農村家庭，兒子外出工作，父母孤獨地在家裏思念兒子，並天天盼望他的電話的故事。,247996,百科,今天我回家,《今天我回家》是由周乾編劇導演的一部關愛父母公益微電影，本土工作室ZZL微電影拍攝，講述的一個農村家庭兒子外出工作，父母孤獨的在家裏時時刻刻的思念，天天盼望等候兒子的電話；一次兒子公司老總母親生病，去醫院看望，在醫院走廊看到聽到的讓他倍感自責，感覺對家的缺少關心，讓他放下一切回家看望父母。《今天我回家》是由周乾編劇導演的一部關愛父母公益微電影，本土工作室ZZL微電影拍攝，講述的一個農村家庭兒子外出工作，父母孤獨的在家裏時時刻刻的思念，天天盼望等候兒子的電話。
胡蘭成是哪年出生的？,根據原文“胡蘭成，1906年出生於中國浙江省嵊縣”可知，胡蘭成是1906年出生的。,248250,百科,今日何日兮,"《今日何日兮》本書爲胡蘭成思想論叢，作者以其一貫的筆法風格、思想體系，寫世界文明與劫毀大自然的基本法則。基本內容 此書基本上是集胡蘭成生前最後的作品及其遺稿而成，是其生前出版未及而待其死後由弟子朱天文彙整的一本著作。其中《世界的劫毀與中國人》提出史上是女人始創文明，其後是男人將它理論學問化——女人，你的名字是文明。胡蘭成再次高談他的新的發想。然而他寫世界文明與劫毀，對美國、日本等國家狂躁的現代工業文明社會之批判，對中國社會的反思，又不無現實的意義，甚至他提出變革社會，重建人世文明的策略，對當代社會都具有深刻的啓發作用。 [1] 作者介紹 胡蘭成，1906年出生於中國浙江省嵊縣，1927年從燕京大學中途退學。後曾任汪僞政權掌控下的《中華日報》總主筆。1943年，結識張愛玲，於次年（1944年）與張結婚，於1947年離婚。 抗戰勝利後，經香港逃亡日本。在日本期間開始學習日語，結識大數學家岡潔和諾貝爾物理學獎得主湯村秀樹，遂成就其學問體系。 1974年來到臺灣，受聘爲臺灣中國文化學院終身教授。在臺灣期間，其文學才能影響了整個臺灣文壇，尤其是朱西寧、朱天文、朱天心父女，受其影響頗深。 1981年7月25日在東京病死。著有中文著作《今生今世》、《山河歲月》、《禪是一枝花》、《中國禮樂》、《中國文學史話》、《革命要詩與學問》、《今日何日兮》等。 目錄 序薛仁明 自序胡蘭成 上卷 世界劫毀與中國人 非同盟政策 今日何日兮 太古劫初成時 要劫毀的由它去劫毀 美國的墜落線 中華民族的大志 劫數論 度得過是節，度不過則是劫 劫字應是好語 大千皆壞，且喜我這個也壞 劫數是易數 文明與理論學問 史上是女人始創文明 其後是男人將它理論學問化 理論學問在卦爻，不在邏輯 文明而無自覺則夭 中國是有文明的理論學問故長久 知識的喜悅與騷動 許多古文明國的滅亡是其文明沒有理論學問化 理論學問要有所本，要有所止 巴比侖是其文明的理論學問化了而未完成，故久而亦亡 希臘的學問始墮於抽象的 中國的理論學問則是具象的 數學與物理學亦要是具象的好 美國的衰退是西洋抽象文化的終焉 印度的空色論可惜不知陰陽 天照大神之國——日本 要曉得天人之際 中國民間對於劫數的感知能力 中國史上的革命是爲對應天道劫數 臨大事是最要親切 好亂人是新世主 中卷 鳳凰鳴於岐山 祭篇 自古是祭政之世悠長 祭祀是文明的造形的基本 寅畏天命 音在弦外 以知貴賤吉凶 祭祀定中國無爲政治之質 祭祀不講靈異 今日我才知中國的原來是祭政一體 即天即神 畏天命 新的史證 郊祀的意義 祭祀亦是賓主之禮 詩與禮 政篇 正名詞 政治的空間與時間 惟王建國 政治在人身之美 把天下襬平 知祭院的所事 今日先要正學問 改制先從打破經濟的迷惘起 減產可以使人有閒暇，知道思省 要產業有情意 下卷 天際遠雷（劉慕沙譯） 民族的精神統一與世界的思想統一 民族的精神統一問題在於中心 大自然的法則決定世界 公準、先是無與物質生滅 「無」與物質生滅 大自然的五基本法則 1. 意志與息的法則 2. 陰陽變化法則 3. 無限時空與有限時空的統一法則 4. 連續與不連續性的統一法則 5. 循環法則 [1] 叢書信息 胡蘭成作品系列 (共11冊), 這套叢書還有 《中國文學史話》,《心經隨喜》,《禪是一枝花》,《中國的禮樂風景》,《華學科學與哲學》 等。 [1]"
鳥山石燕創作的日本鬼怪畫集《今昔百鬼拾遺》包含哪些部分？,根據原文“今昔百鬼拾遺由「雲」、「霧」、「雨」三部構成”可知，鳥山石燕創作的日本鬼怪畫集《今昔百鬼拾遺》包含三部分，分別是“雲”、“霧”和“雨”。,248484,百科,今昔百鬼拾遺,鳥山石燕於1780年創作的日本鬼怪畫集。由「雲」、「霧」、「雨」三部構成。書籍介紹 《今昔百鬼拾遺》，鳥山石燕於1780年創作的日本鬼怪畫集。 今昔百鬼拾遺由「雲」、「霧」、「雨」三部構成。 內容簡介 雲 蜃氣樓（しんきろう）燭陰（しょくいん）人面樹（にんめんじゅ）人魚（にんぎょ）返魂香（はんごんこう）彭侯（ほうこう）天狗礫（てんぐつぶて）道成寺鐘（どうじょうじのかね）燈臺鬼（とうだいき）泥田坊（どろたぼう）古庫裏婆（こくりばば）白粉婆（おしろいばば）蛇骨婆（じゃこつばば）影女（かげおんな）倩兮女（けらけらおんな）煙煙羅（えんえんら） 霧 紅葉狩（もみじがり）朧車（おぼろぐるま）火前坊（かぜんぼう）蓑火（みのび）青行燈（あおあんどん）雨女（あめおんな）小雨坊（こさめぼう）岸涯小僧（がんぎこぞう）あやかし鬼童（きどう）又叫鬼童丸鬼一口（おにひとくち）蛇帶（じゃたい）小袖の手（こそでのて）機尋（はたひろ）大座頭（おおざとう）火間蟲入道（ひまむしにゅうどう）殺生石（せっしょうせき）風狸（ふうり）茂林寺釜（もりんじのかま） 雨 羅城門鬼（らじょうもんおに）夜啼石（よなきのいし）芭蕉精（ばしょうのせい）硯之魂屏風覗（びょうぶのぞき）毛羽毛現（けうけげん）目目連（もくもくれん）狂骨（きょうこつ）目競（めくらべ）後神（うしろがみ）否哉（いやや）方相氏（ほうそうし） 四眼鬼神。右手的神劍可斬妖除魔。瀧靈王（たきれいおう）白澤（はくたく）隠裏（かくれざと）
