question,answer,docid,dataType,title,content
兩岸經濟協議的計劃分爲哪幾個階段？,"根據原文“兩岸經濟協議分爲3個階段: 近期目標是09至2012年,這個階段實施兩岸公平、對等貿易,實現兩岸雙向投資發展,擴大兩岸全面直接三通,促進兩岸金融等重點產業及行業協作發展,大陸在某些領域率先對臺灣開放。中期目標是2012至16年實施,此階段兩岸將簽定""綜合經濟協作協議"",推動兩岸經濟協作機制的深化與發展,達成雙方共同參與亞太區域經濟協作的共識,推動兩岸四地更緊密的經濟協作。長期目標則是2016年後實施,兩岸實現全方位市場開放、經濟融合及經濟制度一體化,推動兩岸與其他地區區域經濟協作發展。”可知，兩岸經濟協議的計劃分爲近期、中期和長期三個階段。",54962,百科,兩岸經濟協議,"兩岸經濟協議是一個自兩岸經貿關係正常化入手,最終走向經濟的完全集成的長期過程。 什麼是兩岸經濟協議:兩岸經濟協議是一個自兩岸經貿關係正常化入手,最終走向經濟的完全集成的長期過程。 兩岸經濟協議的計劃:據商務部對外貿易研究部主任劉雪琴的分析,兩岸經濟協議分爲3個階段: 近期目標是09至2012年,這個階段實施兩岸公平、對等貿易,實現兩岸雙向投資發展,擴大兩岸全面直接三通,促進兩岸金融等重點產業及行業協作發展,大陸在某些領域率先對臺灣開放。 中期目標是2012至16年實施,此階段兩岸將簽定""綜合經濟協作協議"",推動兩岸經濟協作機制的深化與發展,達成雙方共同參與亞太區域經濟協作的共識,推動兩岸四地更緊密的經濟協作。 長期目標則是2016年後實施,兩岸實現全方位市場開放、經濟融合及經濟制度一體化,推動兩岸與其他地區 區域經濟協作發展。"
兩手互握試驗是用來檢查什麼的？,根據原文“兩手互握試驗是兩手交叉互握時應使諸手指的掌指關節與近側指關節固定，是正中神經麻痹的典型檢查。”可知，兩手互握試驗是用來檢查正中神經麻痹的。,108527,百科,兩手互握試驗,兩手互握試驗是兩手交叉互握時應使諸手指的掌指關節與近側指關節固定，是正中神經麻痹的典型檢查。兩手互握試驗正常值 檢查結果爲陰性。食指、中指伸直能屈曲。 兩手互握試驗臨牀意義 異常結果：檢查結果爲陽性，即見其一側食指、中指伸直後不能屈曲，即爲該側試驗陽性，提示正中神經麻痹。 需要檢查的人羣：手指不能活動自如的人羣。 兩手互握試驗注意事項 不合宜人羣：無。 檢查前禁忌：無特殊禁忌。 檢查時要求：檢查放鬆心情，積極面對，並積極配合檢查。兩手交叉互握時應使諸手指的掌指關節與近側指關節固定， 以防止出現假陰性。 兩手互握試驗檢查過程 病人坐位，兩肘支於桌上，兩手舉起，手指交叉作互相握手狀，如見其一側食指、中指伸直後不能屈曲，即爲該側試驗陽性。 兩手互握試驗相關症狀 手足痿弱不用 [1] 參考資料 1. 兩手互握試驗 ．檢驗助手
兩水鎮的人口民族構成是怎樣的？,根據原文“全鎮共有18個村、70個村民小組，3個居民委員會，6569戶，28457人(其中農業人口23675人，非農業人口3703人，流動常住人口1079)，幅員總面積158.58平方公里，耕地面積14765畝(水田4927畝，水澆地7325畝，山旱地2513畝)”可知，兩水鎮共有18個村、70個村民小組，人口數量達到28457人。,108713,百科,兩水鎮,"兩水鎮位於甘肅省隴南市武都區西北部212國道旁，距離武都區城區約12公里；轄區有武罐高速、蘭渝鐵路通過，有長江支流白龍江穿越而過。行政區域面積16860公頃，耕地面積16560畝，平均海拔1108米，年平均降雨量480毫米，年平均氣溫14.2℃，全年無霜期245天。名優特產有大棚蔬菜、油橄欖。地理位置 兩水鎮位於城區以西，東接城關鎮、城郊鄉，南臨舟曲縣鐵壩鄉，西連石門、坪埡鄉，北靠蒲池鄉，東西平均長13.15公里，南北平均寬10.95公里，總面積158.58平方公里，是武都區最大鄉鎮之一。裝機容量15600千瓦的黃鹿壩電廠和白龍江林業管理局機關及部分下屬企業、區渭子溝林場就在境內。鎮政府駐後村，距城區12公里。 [2] 自然環境 兩水鎮依山傍水，北靠秦嶺山系的雷嶺山，南與舟曲縣鐵壩鄉接壤，境內峯巒疊嶂，景色秀美。國營林場面積在境內有15.86萬畝，海拔3600米高聳入雲的擂鼓山橫貫境西南。 白龍江水穿鎮而過，拱壩河流經三墩溝、黃櫨壩、煙墩溝三村與白龍江匯合。全鎮河谷地開闊平坦，土地肥沃；山坡地陡峻，植被較差。全鎮共實施退耕還林8203畝，既改善了自然環境，又爲經濟可持續發展奠定了基礎。 [2] 全鎮氣候溫和，年最高氣溫攝氏36℃，最低氣溫攝氏-9℃，日照時間較長，無霜期江南爲180—230天，江北爲200—260天。一般年降雨量400—600毫米。 [2] 人口民族 人口 全鎮共有18個村、70個村民小組，3個居民委員會，6569戶，28457人(其中農業人口23675人，非農業人口3703人，流動常住人口1079)，幅員總面積158.58平方公里，耕地面積14765畝(水田4927畝，水澆地7325畝，山旱地2513畝) [2] 民族 全鎮有回漢兩個民族，其中漢族27826人，佔98.5%，回族424人，佔1.5%。回族主要居住在兩水、後村、前村三個村。 [2] 經濟概況 兩水是一個多種經濟並存的多元化經濟大鎮。全鎮經濟收入主要依靠勞務、蔬菜、林果、畜牧、商飲服務等，支柱產業爲勞務、蔬菜、西瓜、經濟林果，2007年人均純收入1760元，其中：勞務收入佔56%，特色產業收入佔27%，農業、畜牧業收入佔17%,人均有糧250公斤。 [3] 全鎮以前村無公害大棚蔬菜爲主的蔬菜種植面積每年達6200畝，其中大棚蔬菜1230畝，地膜蔬菜3240畝，露地蔬菜1730畝。以段河壩雙膜西瓜套蔬菜爲主的西瓜種植面積680畝。蔬菜和西瓜畝均年收入在3000元以上。全鎮現有油橄欖面積8470畝(已掛果2310畝)，花椒3860畝。 [2] 公路交通 公路通行現狀 全鎮18個村中，全部通公路，其中，依託212國道的有後壩、兩水、後村、前村、寨子5個村；依託兩水—馬營公路的爲杜家溝1個村；江南10個村中，依託舟曲縣拱壩河公路的有三墩溝(另有槐樹壩到該村三社的通村公路6公里)、黃櫨壩、煙墩溝3個村；2001—2005年，在流域綜合開發治理中新修通村公路6個村58公里，其中，渭子溝—馬入崖8公里(農二級)，渭子溝—朱家山8公里(農三級)，渭子溝--段河壩7公里(農二級)，段河壩—龍王山7公里(農二級)，龍王山—馬尾巴(農二級3.5公里)—朱家山7公里(農三級3.5)，黃路壩—土門埡7公里(農二級)，土門埡—清水坪3公里(農二級)，土門埡—龍王山3公里(農二級)，黃櫨壩—坪埡鄉鏵咀村3公里—黃櫨壩村廟埡族社5公里。 [2] 公路建設設想 公路建設是經濟發展的首要條件，江南各村通村公路的建成，極大地促進了經濟快速發展，爲新農村建設奠定了基礎，隨着社會的不斷發展和進步，現有通村公路已不能滿足通行需求。兩水鎮黨委、政府一班人將在區委、區政府的正確領導下，在區交通局的具體幫助指導下，緊緊依靠全鎮廣大黨員幹部和羣衆，積極爭取上級支持，動員各方面的力量，使交通建設走上一個新的臺階。爭取舟曲縣後壩—沙灘公路加寬鋪油工程建設，改善三墩溝、黃櫨壩、煙墩溝3個村的通行現狀，然後爭取黃櫨壩—土門埡公路的鋪油工程儘快啓動建設(2008年底已開工建設)。 [2] 鎮政府 黨委書記：畢王平 鎮長：龐雲 [4] 全鎮共有30個支部，其中：鎮屬機關單位支部11個，村支部18個，居委會支部1個；黨員總數798名(職工黨員169名，離退休幹部黨員41名，其他黨員9名，農民黨員579名)，女黨員127名，少數民族黨員26名。黨委成員9名，其中鎮幹部8名，村支部書記1名。 [2]"
團幹部爲什麼要參與“兩進三同”活動？,根據原文“‘兩進三同’是指全團各級領導機關幹部‘走進基層，走進青年’、與青年‘同勞動、同學習、同生活’”，可知團幹部參與“兩進三同”活動是爲了進一步瞭解青年學生、青年工人、青年農民，瞭解他們的實際生活狀況，促進和諧社會的建設，同時也是爲了鍛鍊團幹部的成長，發現一批青年骨幹，並向黨組織推優。,109164,百科,兩進三同,兩進三同 “兩進三同”是指全團各級領導機關幹部“走進基層，走進青年”、與青年“同勞動、同學習、同生活”。 作用 1、進一步瞭解青年學生、青年工人、青年農民，瞭解他們的實際生活狀況，促進和諧社會的建設 2、鍛鍊團幹部的成長，發現一批青年骨幹，並向黨組織推優。
嚴娟現任職務是什麼？,根據原文“現任清水河街道勞動保障事務所所長”，可知嚴娟現任清水河街道勞動保障事務所所長。,109545,百科,嚴娟,嚴娟，女，1963年10月出生，四川南充人，大學本科學歷，1982年7月參加工作，1998年6月加入中國共產黨。現任清水河街道勞動保障事務所所長，擬任區投資推廣局六級其他管理崗位職員。 [1] 百度百科內容由網友共同編輯，如您發現自己的詞條內容不準確或不完善，歡迎使用本人詞條編輯服務（免費）參與修正。立即前往 參考資料 1. 嚴娟 ．中國政府公開信息整合服務平臺[引用日期2015-01-13]
嚴節這個詞是什麼意思？,根據原文“嚴節，是漢語詞彙，解釋爲急促的音節。1.《文選·張協》：“若乃追清哇，赴嚴節，奏《綠水》，吐《白雪》此蓋音曲之至妙，子豈能從我而聽之乎？” 李善 注：“嚴節，急節也。””可知，嚴節指的是急促的音節，具有快速的節奏。,110099,百科,嚴節,嚴節，是漢語詞彙，解釋爲急促的音節。1.《文選·張協》：“若乃追清哇，赴嚴節，奏《綠水》，吐《白雪》此蓋音曲之至妙，子豈能從我而聽之乎？” 李善 注：“嚴節，急節也。” 2.指冬至節。《初學記》卷三引 南朝 梁元帝 《纂要》：“冬曰玄英節曰嚴節。” 參考資料 1. 嚴節 ．在線漢語字典[引用日期2018-10-04]
遊戲《喪屍感染》的操作指南包括哪些內容？,根據原文“喪屍感染操作指南 WASD方向鍵：移動 Shift：跑 滑鼠：射擊 1-5：轉武器R：Reload Space：拾東西開門 X:醫療包 C:避彈衣 M:小地圖”可知，遊戲的操作指南包括使用WASD方向鍵來移動，使用Shift來跑，使用鼠標來射擊，使用1-5來轉武器，使用R來reload，使用Space來拾東西和開門，還可以使用X獲取醫療包，使用C獲取避彈衣，以及使用M來查看小地圖。,110371,百科,喪屍感染,《喪屍感染》是一款動作小遊戲，遊戲大小爲2702K 。喪屍感染背景設定 隕石墜落，並帶來太空細菌，引發村民病變感染成爲喪屍，本來你和隊友被派遣追尋病毒源頭，但現在只淨下你，你要活着逃出四周都是喪屍廢棄的防空洞。 喪屍感染操作指南 WASD方向鍵：移動 Shift：跑 滑鼠：射擊 1-5：轉武器R：Reload Space：拾東西開門 X:醫療包 C:避彈衣 M:小地圖 喪屍感染遊戲目標 享受遊戲樂趣。 參考資料 1. 喪屍感染 ．3366小遊戲[引用日期2013-01-08]
9377出品的網頁遊戲《魅影傳說》中的個人boss活動玩法有哪些？,根據原文“在9377魅影傳說遊戲中，有着衆多的boss分佈在各個地圖之中，但要挑戰boss的玩家衆多，戰力低的玩家根本就搶不到boss，不用擔心，有個人boss供玩家單人挑戰”以及“個人boss除了第一個山大王是免費進入的外，其他的都需要boss挑戰令，而且boss等級越高，需要的boss挑戰令就越多，最高的需要20個”。在《魅影傳說》中，玩家可以通過個人boss活動進行單人挑戰，共有8個個人boss分別對應不同等級，除第一個山大王外都需要boss挑戰令，玩家可通過各種途徑獲得。,111118,百科,個人boss,個人boss，是9377出品的網頁遊戲《魅影傳說》中的活動玩法，玩家可以通過該活動獲得裝備、玉石、靈魂碎片等獎勵。活動介紹 在9377魅影傳說遊戲中，有着衆多的boss分佈在各個地圖之中，但要挑戰boss的玩家衆多，戰力低的玩家根本就搶不到boss，不用擔心，有個人boss供玩家單人挑戰。 活動玩法 魅影傳說個人boss共有8個，分別是40級的山大王、50級的骷髏王、65級的獸王、80級的惡魔統領、100級的千年樹妖、120級的雪人阿布、130級的濱海島主、150級的鯰魚王。 個人boss除了第一個山大王是免費進入的外，其他的都需要boss挑戰令，而且boss等級越高，需要的boss挑戰令就越多，最高的需要20個。Boss挑戰令可在魅影傳說活躍獎勵、使用榮譽兌換、擊殺野外怪物掉落獲得。 每個個人boss進入挑戰也有等級限制，最高的鯰魚王需要等級95級，即玩家只要達到95級便可挑戰所有的個人boss。個人BOSS難度較低，以副本的形式挑戰，每個boss每人每天可以挑戰1次。 活動獎勵 挑戰魅影傳說個人boss，打敗boss有機會獲得boss掉落的物品，主要是各等級的紫裝，還有各等級玉石、靈魂碎片、五行石、晶石等等道具，而且在個人boss副本通關以後還可以在面板上領取額外的獎勵 [1] 。
個人工作日程表的作用是什麼？,根據原文“個人工作日程表 管理你日常工作的事項，根據日期的不同顯示當天的所有代處理事項，對於緊急和重要事項突出顯示，提醒你優先處理。”可知，個人工作日程表的作用是管理日常工作事項，根據日期顯示當天的代處理事項，突出顯示緊急和重要事項，提醒優先處理。,110744,百科,個人工作日程表,個人工作日程是管理你日常工作的事項表。個人工作日程表 管理你日常工作的事項，根據日期的不同顯示當天的所有代處理事項，對於緊急和重要事項突出顯示，提醒你優先處理。可以隨時增刪改工作事項，如遇到問題，請聯繫我！ [1]
個人稅號的法律地位是什麼？,根據原文“2015年2月3日，《稅收徵收管理法修訂草案（徵求意見稿）》在國務院法制辦徵求意見截止。這份內容豐富的意見稿一個突出特點就是明確了納稅人識別號制度的法律地位。”可知，個人稅號的法律地位在《稅收徵收管理法修訂草案（徵求意見稿）》中得到了明確。,110960,百科,個人稅號,2015年2月3日，在國務院法制辦徵求意見結束的《稅收徵收管理法修訂草案（徵求意見稿）》發佈，個人稅號時代漸行漸近。主要介紹 今後的日常生活中，只要涉及合同、協議都會要求提供個人稅號，買賣、租賃房屋中需要提供；炒股票、買保險時需要提供；銀行也會在每筆大額轉賬時，向稅務部門提供賬戶人的個人稅號。 [1] 明確地位 2015年2月3日，《稅收徵收管理法修訂草案（徵求意見稿）》在國務院法制辦徵求意見截止。這份內容豐富的意見稿一個突出特點就是明確了納稅人識別號制度的法律地位。 [2]
保險人的具體形式有哪些？,根據原文“保險人的具體形式有保險股份有限公司、相互保險公司、相互保險社、保險合作社、國營保險公司及專業自保公司”可知，保險人的具體形式包括保險股份有限公司、相互保險公司、相互保險社、保險合作社、國營保險公司及專業自保公司。,111135,百科,個體保險人,個體保險人亦稱“個人保險”，以個人名義承保風險的一種保險組織形式。英國倫敦保險市場上的勞合社是以個體保險人爲代表。勞合社的承保成員各爲自己承擔的保險份額負無限責任，而不承擔任何其他成員的賠償義務。各承保成員的全部財產都是履行保險合同的抵押品，如一旦發生事故，某一個體保險人無法履行保險協議時，勞合社將以其全部財產承擔責任。根據中國《保險法》規定，保險人又稱“承保人”，是指與投保人訂立保險合同，並承擔賠償或者給付保險金責任的保險公司。 在中國有股份有限公司和國有獨資公司兩種形式。 保險人是法人，公民個人不能作爲保險人。 保險人的具體形式有保險股份有限公司、相互保險公司、相互保險社、保險合作社、國營保險公司及專業自保公司。 參考資料 1. 李偉民．金融大辭典：黑龍江人民出版社，2002－11
什麼是個展？,根據原文“個展是一個漢語詞語，讀音是gè zhǎn，是指個人作品展出。”可知，個展是指個人作品展出。,111282,百科,個展,"個展是一個漢語詞語，讀音是gè zhǎn，是指個人作品展出。個展基本信息 拼音 ：gè zhǎn 注音： ㄍㄜˋ ㄓㄢˇ 反義詞：聯展 個展詞語解釋 ◎個展gèzhǎn [exhibition of one person's works]個人作品展出 1979年秋天,林鳳眠在巴黎舉行個展 [1] 參考資料 1. 詞語 個展 的解釋 ．漢典[引用日期2014-11-06]"
個案工作的基本定義是什麼？,根據原文“作爲現代社會工作三大方法之一的個案工作是一個助人的歷程，是以個人或個別家庭爲服務對象，讓其更好發揮社會功能。其目的是幫助人們解決本身能力和資源無法解決的問題。”可知，個案工作的基本定義是以個人或個別家庭爲服務對象，幫助他們解決本身能力和資源無法解決的問題，讓其更好發揮社會功能。,111443,百科,個案工作,個案工作是專業工作者遵循基本的價值理念，運用科學的專業知識和技巧、以個別化的方式爲感受困難的個人或家庭提供物質和心理方面的支持和服務，以幫助個人或家庭減低壓力、解決問題、挖掘生命潛能，不斷提高個人和社會的福利水平的一種社會工作方法。個案工作基本定義 作爲現代社會工作三大方法之一的個案工作是一個助人的歷程，是以個人或個別家庭爲服務對象，讓其更好發揮社會功能。其目的是幫助人們解決本身能力和資源無法解決的問題。 在協助過程中，個案工作者與案主之間維持着面對面或一對一的專業關係，運用專業知識、理論、方法與技巧協助失調的個人改善環境，增進生活適應能力；協調社會關係，建立良性互動網絡；調適自我功能，促進人格發展；以健康、成熟的心態，來認識及面對問題，充分發揮自己的潛能，善用社會資源和機會，來解決問題，以提升自我信心和生活質量。 個案工作基本原則 （一）個別化原則 含義：將案主看成獨特的個人，重 視案主對待困難和問題的感受與看法。 要求：社會工作者認同和了解每個個案的獨特性，並運用不同的原則和方法來幫案主達成較好的適應。 （二）接納原則 含義：接納他人，尊重、欣賞個人和團體的差異 要求：社會工作者承認案主有自由 表達情感（包括負面情感）的權利， 應投入地聆聽，既不阻止，也不責備。 （三）承認的原則 含義：承認案主作爲一個人的價值、發 展潛能以及改變的能力。 要求：不能以輕視、反感、責備的態度 對待案主，應抱有尊重的態度，幫助案主從防衛中解脫出來，以更有效的 方法來面對自己的問題。 （四） 理解關懷的原則 含義：案主常常希望自己的感受或 表達出的情感，能得到工作者的瞭解、支持與共鳴。 要求：在個案工作中，社會工作者需要適度的情感介入。 （五） 非評判的原則 含義：社會工作者在實踐中不能簡單地 否定服務對象，不能以自己的價值文化去批判服務對象。 要求：工作者以非評判的態度瞭解案主 及其問題，在適當的時候向案主說明工作者的工作是幫助他，而不是審視他、評判他、給他做結論。 （六） 案主參與及自決的原則 含義：尊重案主自我決定的權利，不能幫案主做最後的決定。 要求：社會工者應處於分擔、支持、提示的地位，他可以告訴案主如何獲得幫 助，但該建議是否被採用則由案主自己決定。 （七） 保密性原則 含義：保守案主在專業關係中所顯露的祕密。 要求：一方面社會工作者對不必要的事項不要深究，另一方面對必要的資料應注意保密。 方式：不向他人透漏案主的姓名、資料， 不向他人提及會談的過稱及內容，不讓他人旁觀。 [1] 個案工作特點 注重以個人爲工作對象； 注重建立一對一的專業助人關係； 注重個人和社會兩方面的調整，兼顧形成問題的內因和外因； 注重知識基礎。 個案工作作用 幫助個人或家庭善用社會資源； 幫助個人或家庭挖掘潛能； 幫助個人或家庭適應新的生活轉變做準備； 幫助個人或家庭處理突發性的危機事件 個案工作相關區別 從處理的問題看，心理輔導着重處理較嚴重的精神病疾患，如精神分裂症、人格異常、心因性軀體題症狀等。個案工作處理一般性的情緒不適或心理困擾性的神經症，如焦慮不安、抑鬱等。 從知識背景看，生理學、精神醫學和心理學是心理治療與輔導工作的主要知識基礎。它強調對於所遇到的問題和所處的環境作出個人調整，而不以改變個人的生存環境爲己任，所以較少觸及挖掘社會資源和改變社會機制的問題。個案工作處理的是個人社會功能發揮方面的問題，這些問題有些是心理方面的因素造成的，更多的則是環境方面阻礙個人正常發揮社會功能的因素。社會學、社會心理學、政治學、管理學、文化人類學、社會醫學等是個案工作者的主要知識基礎。 從工作手法看，心理輔導強調的是“攻心”術，“心病要用心藥醫”。個案工作除挖掘個人潛能，讓個人做調適之外，還強調調動個人之外的組織和社區資源來解決問題。 從工作關係看，在我國，心理輔導與治療員在當事人的關係中多充當權威人物，以專家的身份面對當事人，他對當事人負有專業責任。個案工作員強調與當事人保持平等的工作夥伴關係。對人的價值、獨特性、自決權的尊重，是社會個案工作關係強調的重點，工作員在這一關係裏不僅負有專業責任，常常還肩負着社會責任。 參考資料 1. 個案工作的方法 ．中華文本庫．2008-12-12[引用日期2013-11-27]
在遊戲中，如何進行裝扮操作？,根據原文“遊戲使用鼠標點擊裝飾按鈕，進行裝扮”可知，在遊戲中，玩家需要使用鼠標點擊裝飾按鈕，然後進行裝扮操作。,111706,百科,中世紀女戰士裝扮,"背景設定 時光倒流到中世紀，這是個即將上戰場的女戰士，快來幫她好好打扮一番吧！本遊戲爲裝扮類遊戲,深受女生,女白領的喜歡,喜歡打扮的女生快來玩吧！ 操作指南 遊戲使用鼠標點擊裝飾按鈕，進行裝扮。 如何開始：遊戲加載完成後點擊play - 再點擊start開始遊戲 遊戲目標 給人物打扮，如果扮得漂亮，別忘了把圖片發在頁面下的評論中跟大家一起分享哦！ [1]"
