question,answer,docid,dataType,title,content
什麼是健康網？,根據原文“健康網是一類免費爲廣大網民羣衆提供健康信息類資訊的網站。”可知，健康網是一類免費爲廣大網民羣衆提供健康信息類資訊的網站。它提供專業、完善的健康信息服務，包括疾病、保健、健康新聞、專家諮詢、病友論壇等。,324728,百科,健康網,健康網是一類免費爲廣大網民羣衆提供健康信息類資訊的網站。簡介 健康類的信息主要包括：提供最專業、完善的健康信息服務，包括疾病，保健，健康新聞，專家諮詢，病友論壇，男科，婦科，育兒，性愛，心理，整形，減肥，藥品，急救，中醫，美容，飲食，健身，醫院查詢，醫生查詢，疾病查詢，藥品查詢，化驗體檢，疾病自測等。 健康標準 世界衛生組織提出:食得快：進食時有很好的胃口，能快速喫完一餐飯而不挑剔食物，這證明內臟功能正常。便得快：一旦有便意時，能很快排泄大小便，且感覺輕鬆自如，在精神上有一種良好的感覺，說明胃腸功能良好。睡得快：上牀能很快熟睡，且睡得深，醒後精神飽滿，頭腦清醒。說得快：語言表達正確，說話流利。表示頭腦清楚，思維敏捷，中氣充足，心、肺功能正常。走得快：行動自如、轉變敏捷。證明精力充沛旺盛。良好的個性：性格溫和，意志堅強，感情豐富，具有坦蕩胸懷與達觀心境。良好的處世能力：看問題客觀現實，具有自我控制能力，適應複雜的社會環境，對事物的變遷能始終保持良好的情緒，能保持對社會外環境與機體內環境的平衡。良好的人際關係：待人接物能大度和善，不過分計較，能助人爲樂，與人爲善。適量運動：運動能改變血液中化學成分，有利於防止動脈血管硬化，保護血液、維護心血管系統的健康。要經常參加以耐力性爲主的運動項目，如跑步、球類、登山等.。心理健康重要性。 網站分類 健康網站在實際應用中有不同的類型：專業的資訊類、門戶類網站、諮詢類網站、綜合類健康網站等。隨着全國各地的醫院網站逐漸建立，醫院的門戶網站也在健康類網站中突起，網上具有醫患交流平臺，方便醫患關係之間的直接對話。 國內網站 神威健康網萬度健康網有愛健康網中國健康新聞網健康衛視中國健康世界網中國健康網中華網健康頻道醫易健康網99便祕網79健康網99健康網39健康網愛友康六一健康網看病有問必答網120健康網健康問答網河北21健康網問醫生網健康好事通健康報網康膚網精神科網飛華健康網中華視頻養生網中國求醫網中國性健康網久久健康網一路健康網安徽醫療網四海網誠敬健康網健康區女性健康網現代健康網IT健康人晉康網中國康網Love健康網肛腸健康網自然健康網康帝健康生活網 未來潛力 健康類網站用戶定位於非健康和亞健康人羣，亞健康是介於疾病和健康之間的“中間狀態”，中國亞健康人羣的比例已達76%以上，也就是說，絕大部分人(絕不僅僅是老年人)都面臨科學養生的命題。以上海爲例，據微微健康網的一份調查，上海市健康人羣佔16%，非健康人羣佔14%，亞健康人羣佔70%(其中輕度患者約佔40%，慢性患者約佔30%)。據有關資料顯示，我國目前處於亞健康狀態的人羣比例已上升到75%。而且亞健康不僅僅是城市人羣和腦力勞動者的專利，波及面正在迅速、不斷地擴張。上海市人口已經達到1640萬，非健康人數爲230萬、亞健康人約1148萬，二者合計爲1378萬。根據中國互聯網信息中心（CNNIC）第十九次互聯網發展統計報告，上海市網民數占人口總數的28.70%，按此比例，可以預計上海市擁有395萬左右具備上網條件的非健康和亞健康人羣，這就是健康類網站目標市場。以此類推其它城市和地區，我們可以預見隨着中國互聯網的快速發展，健康類網站的目標客戶羣是一個巨大的市場。2009-2010中國互聯網調查顧問民衆健康網運營總劉曉霞在接受中國互聯網協會、DCCI互聯網數據中心主辦的2007-2008中國互聯網調查一對一調查訪問時說：醫療健康類網站運營可以細分爲醫療類、藥類、綜合信息類、健康管理類、B2B、B2C類、醫療健康信息的搜索等多種模式。醫療健康類網站尚處於起步階段，競爭激烈，多數網站只能實現收支相抵，盈利很少，而且還要面臨醫療政策的發展和變化這個最大的變數。從未來的發展趨勢來看，受惠於居民健康意識的增強，互聯網滲透率的提高，風險投資的資本推動，醫療健康網站領域將實現翻倍增長，行業發展前景樂觀。但是要取得發展成功，則需醫療健康網站要找到適合本行業的商業模式，以及具備強有力的資本支持及其他資源如醫院等支持 。
什麼是健美小姐競選？,根據原文“健美小姐競選（Miss Aerobic Beauty Pageant），是TVB在1985年舉辦的一項選美活動，舉辦目的是要抗衡當年首屆亞洲小姐競選，與亞洲電視進行收視上的競爭。”可知，健美小姐競選是TVB在1985年舉辦的選美活動，旨在與亞洲電視進行收視上的競爭。,324940,百科,健美小姐,健美小姐競選（Miss Aerobic Beauty Pageant），是TVB在1985年舉辦的一項選美活動，舉辦目的是要抗衡當年首屆亞洲小姐競選，與亞洲電視進行收視上的競爭。之後直至2000年代才辦第二屆，此後再沒舉辦。本條目的資料皆爲1985年首屆之記事。健美小姐簡介 健美小姐指的是從事健美運動的一類人，如人們熟知的馬菁宜。 馬菁宜也許不是世界上肌肉最發達的人，但若從肌肉的飽滿度、清晰度以及身體的勻稱度綜合來衡量，馬菁宜則 馬菁宜 獨步江湖，天下第一。 健美小姐發展趨勢 實際上，健美運動有兩種發展趨勢：一是健身健美，目的是練出勻稱漂亮的身材，提高身體的健康水平。二是競技健美，通過科學的訓練、合理的營養和充分的恢復，最大限度地發達全身肌肉。這種趨勢在娛樂圈中反映出來，“健美小姐”又開始大行其道。 健美小姐概念解釋 健美和健身是兩個不同的概念。健身是健美的初級階段，要求簡單：骨架比例勻稱，肌膚光滑，健康，端正，姿勢、動作、音樂協調等就可以了，健身大多數人能夠做到。而健美，不僅要具有健身的條件，還需要具有超常的健康和超常的毅力，身體各肌肉羣的肌肉形狀美觀，皮脂極低，背爲倒三角形，考察運動員的肩，背，腹，腿等各個肌肉的圍度。健美對於腿部力量和肌肉的分離度與質感要求比較嚴格。因此訓練的標準是從肩部到腰部是倒三角，從腰部到大腿中部最寬處是正三角，肩部應該儘量寬，大腿應該儘量粗，腰部應該儘量細。因此在訓練時往往努力增加肩寬，發達三角肌和背闊肌等大小肌羣。而健身往往要求一種綜合素質的體現，不光是發達的肌肉，而且要求整體的線條美。
如何製作健腐肉？,根據原文“健腐肉是一道焦作的特色菜，主要材料是豬五花肉。將五花肉先改刀成四大塊，沸水下鍋用小火煮15分鐘，撈出後用直刀法改制成大片，放入攪碎的健腐、白糖、醬油、糖色、蔥絲和薑絲拌勻，裝入扣碗，入籠中旺火蒸40分鐘出鍋翻扣入盤內即可。蒸五花肉的火候要足，以達到入口即化的效果。”可知，製作健腐肉需要將五花肉煮熟後改刀成大片，然後加入健腐、白糖、醬油、糖色、蔥絲和薑絲拌勻，再蒸40分鐘即可。,325120,百科,健腐肉,健腐肉是一道焦作的特色菜，主要材料是豬五花肉。配料: 健腐2塊約40克。 白糖50克，醬油5克，糖色5克，蔥絲、薑絲各5克。 特色:色澤鮮明透亮，香味濃郁，肥而不膩。 操作: 將五花肉先改刀成四大塊，沸水下鍋用小火煮15分鐘，撈出後用直刀法改制成長8釐米、寬2釐米、厚0.2釐米的大片，放入攪碎的健腐、白糖、醬油、糖色、蔥絲和薑絲拌勻，裝入扣碗，入籠中旺火蒸40分鐘出鍋翻扣入盤內即可。 貼士：蒸五花肉的火候要足，以達到入口即化的效果。 健腐製法：500克豆腐入籠中大火蒸半個小時左右，出鍋切成4釐米見方的小塊，放入鹽150克、醬油75克、香料水（泡入桂皮、香葉、八角、蔥、姜的涼開水），入罐中密封1星期左右。也可用腐乳代替。
《偶像時間》漫畫的作者是誰？,根據原文“漫畫作者：佔谷奈央”可知，漫畫《偶像時間》的作者是佔谷奈央。,325416,百科,偶像時間,"愛可在國中畢業典禮上，被第一個男友說：“你是排第三個的女人！”就這樣而失戀了~~~當她在校園傷心哭泣的時候，卻遇到了流着淚從她眼前走過的航……彙集四個短篇，體會甜美的浪漫故事。漫畫介紹 漫畫作者：佔谷奈央 漫畫類型：浪漫愛情漫畫 關注指數：關注度7.0度 - [有2人關注中] 漫畫狀態：完結 上架日期：2006-05-09 02:12 更新情況：[完結] - 更新於2006-05-09 06:36 《偶像時間》漫畫簡介 畫風有點特別,故事的設定與描繪方式也有點特別,好壞與否,看了再說！ [1]"
《偶然的相遇》這首歌是由誰填詞的？,根據原文“《偶然的相遇》是由王文元填詞”可知，這首歌是由王文元填詞的。,325608,百科,偶然的相遇,《偶然的相遇》是由王文元填詞，鄧麗君演唱的歌曲。歌曲歌詞 雖是偶然地相遇 我卻無法忘記你 你的心裏可否知道 我已深深喜歡你 如果有這麼一天 我已愛上你 你會不會接受我這份真情意 我希望下一次再遇見到你 我倆已經不只是偶然的相遇 雖是偶然地相遇 我心卻已嚮往你 你的心中可否已有 我的一片深情意 如果有這麼一天 我已愛上你 你會不會接受我這份真情意 我希望下一次再遇見到你 我倆不再屬於 那偶然的相遇
《偷天弓》中的主要人物有哪些？,根據原文“偷天弓相關人物 許漠洋：冬歸城守，號稱冬歸第一劍客。明將軍率大軍攻破冬歸城，許漠洋嬌妻幼子均喪命於此... 林青：八方名動之暗器王，排行第五，卻是八方名動中唯一以武名。與無雙城有表親關係... 明宗越：邪派六大宗師之一，朝中一人之下，萬人之上的將軍。 昊空門中傳人，忘念之徒，其絕學“流轉神功”已達七重氣滅之界... 巧拙：昊空門中傳人，明將軍的師叔，精修天命寶典。七年前來冬歸城外伏藏山中隱居，對許漠洋青睞有加...”可知，《偷天弓》中的主要人物包括許漠洋、林青、明宗越和巧拙。,325802,百科,偷天弓,偷天弓是時未寒明將軍系列正傳的第一部作品。血雨江湖。明將軍權傾朝野，威懾天下，逞淫威、除異己，八方震動。萬馬軍中，暗器王林青射出了驚天動地的一箭；《天命寶典》道破玄機，“偷天弓”驚天出世；註定了絕頂之上，那改天換地的一場曠世之戰……。偷天弓簡介 冬歸城守許漠洋聽從明將軍師叔巧拙大師遺命，會合笑望山莊莊主容笑風、無雙城主之主楊霜兒、英雄冢 偷天弓 棄徒物由心、兵甲傳人杜四，合五行三才之力煉成惟一能擊敗明將軍流轉神功的神兵－－偷天弓。 而暗器王林青亦介入其中，先射殺朝廷命官，再力斃登萍王顧清風，最終幽冥谷中執偷天弓與明將軍初戰告負，二人遂定下日後賭戰之約 偷天弓作者簡介 偷天弓概述 時未寒，四川人，原名王帆，大陸新武俠代表作家之一。2000年底接觸網絡，開始寫作，以“相信意外”的筆名發表在榕樹下，題材涉及武俠、科幻、現代、奇幻等。 2001年七月開始創作武俠小說《破浪錐》。 2002年九月完成第一部十三萬字的武俠長篇《碎空刀》，同年底以“時未寒”的筆名發表在《今古傳奇武俠版》。 目前爲職業撰稿人，至今已在各類雜誌上發表作品一百餘萬字。主要發表武俠作品： 《今古傳奇武俠版》：長篇：《碎空刀》、《偷天弓》、《換日箭》、《絕頂》，目前正在連載《山河》；中篇：《避雪傳奇》、《破浪錐》、《竊魂影》。 《武俠故事》：長篇：《劍氣俠虹》；中篇：《釵頭鳳》、《驚殺局》。 系列介紹: 明將軍系列： 《偷天弓》《換日箭》（又稱《偷天換日》） 《絕頂》 《山河》 外傳： 《碎空刀》《竊魂影》《破浪錐》 注：明將軍系列作品的故事發生的時間順序應爲:《偷天弓》→《破浪錐》→《竊魂影》→《換日箭》→《絕頂》→《碎空刀》 偷天弓相關人物 許漠洋：冬歸城守，號稱冬歸第一劍客。明將軍率大軍攻破冬歸城，許漠洋嬌妻幼子均喪命於此。冬歸城被攻破時，許漠洋因與巧拙大師有約，拼死突圍去伏藏山與之相會。後巧拙大師一眼傳神於其《天命寶典》，從伏藏山逃出生天，許漠洋從此結識杜四、楊霜兒、林青、物由心、容笑風等人，諸人聯合一起鍛造偷天弓以對付明將軍。偷天弓最終功成，親眼目睹暗器王與明將軍一戰。後隱匿尋找換日箭。 林青：八方名動之暗器王，排行第五，卻是八方名動中唯一以武名。與無雙城有表親關係，與杜四早年結識，結爲至交。林青追求武道之高峯，視明將軍爲天下第一敵手，與許漠洋等人一道在笑望山莊煉製偷天神弓，先陣前一箭射殺崔元給明將軍下第一道戰書，偷天弓成之日，心傷好友杜四之死，偷天弓初試鋒芒，含憤一擊擊殺與齊名的登萍王顧清風。後與明將軍一戰，明勝實敗，然後帶着偷天弓浪跡天涯，追尋武道之高峯並尋找換日箭。 明宗越：邪派六大宗師之一，朝中一人之下，萬人之上的將軍。 昊空門中傳人，忘念之徒，其絕學“流轉神功”已達七重氣滅之界。此次前來攻破冬歸城，卻巧遇師叔巧拙。後曾探入笑望山莊查看偷天弓的煉製，不出一招已擊殺諸人氣勢，後與諸人相約欲與偷天弓一決。不閃不避硬接林青偷天換日之箭，佯敗。最後把容笑風作爲人質帶往京師。 巧拙：昊空門中傳人，明將軍的師叔，精修天命寶典。七年前來冬歸城外伏藏山中隱居，對許漠洋青睞有加，更曾從側面指點過其武功，雖無師徒名份卻有師徒之實。一眼傳神許漠洋後，悟道而亡，雷擊使其飛灰煙滅。巧拙爲對付明將軍，早有謀劃，暗中聯絡無雙城、笑望山莊、兵甲派杜四等人，並繪製偷天弓，傳神於許漠洋後，使許漠洋承其遺志聯絡各人制造偷天弓及換日箭以對付明將軍。 偷天弓目錄 一 、一眼慈悲 二、二字天書 三、三千白髮 四、四笑於掌 五、五行鑄兵 六、六色春秋 七、 七級浮屠 八、 八方名動 九、九轉回腸 十、 十面楚歌 十一、 百折不屈 參考資料 1. 偷天弓 ．豆瓣[引用日期2020-03-11]
《傍晚敲門的女人》這部小說的作者是誰？,根據原文“傍晚敲門的女人，中篇小說名，作者李迪”可知，該小說的作者是李迪。,327349,百科,傍晚敲門的女人,傍晚敲門的女人，中篇小說名，作者李迪，作者以第一人稱的敘述方式，描寫了一個偵破殺人兇案的故事：電器公司的總經理王少懷在他的養父家被人用銳器殺死，從傷口判斷，用力的程度足以說明兇手對於死者的仇恨……偵查線索緊緊圍繞王少懷身邊的幾個女人展開；原來，王少懷雖然在電子專業上頗有成績，卻是個道德敗壞的情場老手，公司醫務室的女醫生歐陽雲和女翻譯金飛飛先後成了他的掌中玩物；煤廠工人丁力暗戀歐陽雲，當他得知她被王少懷欺騙後義憤填膺，最終將其殺死；這部小說問世之後反響巨大，曾入選當代中國公安文學大系叢書。圖書資料 書名： 傍晚敲門的女人 作者：李迪著 ISBN7-80082-349-0 出版社：華齡出版社 出版地：北京 頁碼：353頁 定價：15.80元 出版日期：1997.11 內容提要 纏綿 悱惻的情書，淒厲絕望的狐叫，被害男人的死與傍晚敲門的女人有關。但可能前往敲門的女人卻不止一個這是《傍晚敲門的女人》所要給你講述的推理故事。 《傍晚敲門的女人》是一篇發表較早、引起較大轟動的偵探小說；作家李迪以第一人稱的敘述方式，描寫了一個偵破殺人兇案的故事。 樑子作爲一個預審員，在接到丁字街兇殺案的時候，並沒有親身來到兇案現場做實地偵查，他面對的只是一份關於案件現場的報告。樑子依據這些材料進行初步的分析推理，首先排除無關人員，當“傍晚敲門的女人”這個線索越來越清晰起來以後，案件的主要涉嫌人歐陽雲也就從卷宗後面走到了讀者面前，從而拉開了心理戰的序幕。 這場 心理戰的演進，一波三折，充分體現了偵探小說的藝術魅力。 在心理戰的第一階段，歐陽雲採取堅壁清野的態度，而樑子則響鼓重錘，不失時機地偵查對方的突破口；心理戰進入第二階段，歐陽雲的防禦陣地在樑子的強烈攻勢下土崩瓦解，不得不承認自己在案發的時間裏到過現場，但她仍一口咬定王少懷不是她殺的；在心理戰的第三個階段，歐陽雲的態度發生了突變，歇斯底里地大喊着自己是殺人兇手。 樑子覺察到歐陽雲不顧一切想迅速了結此案的後面隱藏着重要的祕案。通過推理，他理智地推翻了自己原來對於歐陽雲的懷疑，讓偵查從頭開始，案件終於大白於天下。 小說評價 這部小說完全擺脫了對西方小說的模仿，偵探既沒有像福爾摩斯那樣在罪案發生的現場爬來爬去，尋找罪犯留下的蛛絲馬跡，也沒有像杜賓那樣在小說的結尾才侃侃而談，在一張安樂椅上揭開案件的謎團。 小說給人最深刻的印象該是支撐起整部小說情節框架的和推理程序的那場偵探與涉嫌人之間的心理戰——正是這場心理戰，使《傍晚敲門的女人》躍居當代中國偵探小說上乘之作的行列。 《傍晚敲門的女人》問世後在國內產生極大影響，並陸續在俄羅斯、法國、韓國翻譯出版，開創了中國推理小說走向世界之先河；此外有同名連環畫、有聲小說 [1] 等問世。
什麼是儲備店長？,根據原文“概述儲備店長是企業爲了滿足自身快速擴張帶來的用工需求，所作的‘蓄水池’準備。”可知，儲備店長是企業爲了應對快速擴張帶來的用工需求而進行的人才儲備計劃。公司爲儲備店長制定培養計劃，使其能夠在短期內快速提升個人能力，最終成長爲店長。,327517,百科,儲備店長,概述儲備店長是企業爲了滿足自身快速擴張帶來的用工需求，所作的“蓄水池”準備。公司的人力資源部會爲儲備店長制定培養計劃，如果儲備店長可以順利應對各種挑戰，實現短期內個人能力的快速提升，那麼他就能成長爲店長。爲拓展版圖佈局 既然名爲儲備幹部，企業必定有拓展計劃，就拿滙豐銀行（HSBC）來說，便是着眼於未來5年主管空缺而規劃。滙豐銀行訓練暨員工發展部副總裁朱敏傑說，生意大了、人多了，滙豐對主管的需求量也在增加，等到那時再對外招聘就太遲了，滙豐強調“一脈相傳”的企業文化，會希望有一羣喝HSBC奶水長大的人引領公司發展，給後期儲備人才。 引進多元活力 除了替未來做準備，引進有其他工作經驗的儲備幹部，也能爲企業帶進新活力。屈臣氏人力資源部總監認爲，零售是一個很有彈性的行業，消費者的喜好、消費方式一直在變，假如店長都是從內部員工升任，其過去的成功經驗反而可能侷限了發展。指出，擁有不同行業經驗的儲備幹部，往往能提出超脫舊有做法的新觀點，當公司推行新的想法時，他們接受度也比較高，無形中影響其他老員工。 學校無相關課程 有些行業持續招募儲備幹部，與專業難以養成有關，例如量販賣場、便利商店等流通業，尋遍國內各系所也找不到相關訓練課程，業者唯有自行培養人才。企業對儲備幹部的條件限制各有不同，雖然部分公司會對應徵者的學歷設限，但多數歡迎新人嘗試。企業招聘儲備幹部的政策也不盡相同，有些人一出手便是幾百人，有些採取精兵主義，每年的儲備幹部名額限制在15位以下，像IKEA、滙豐銀行、都只招募10-12位，原因是投注的訓練資源龐大，擔心儲備幹部人數太多會照顧不來。 舉例 以IKEA爲例，不僅爲每位儲備幹部安排不同進度的訓練與實習，還指派一位Coach（教練）、Mentor（導師）指導業務技巧、解決學習遇到的疑難雜症，並且安排一位人力資源經理做輔導，連儲備幹部的精神層面都照顧到。 滙豐每年只錄取10位儲備幹部，2年培訓投資的每個人身上的經費高達1、2百萬元，因此培訓期間若有人進度落後，訓練部門就要加強輔導，希望這10個人可以團進團出，因爲畢竟滙豐投下相當多的時間與心力。 哪些企業會招收儲備店長呢？招收儲備店長的企業多數分佈在零售業和餐飲連鎖業，如咖啡店，冰激凌店、量販賣場和便利店。他們的共同特點是，企業在快速發展階段或有新的市場增長點時，需要有熟悉並適應企業經營理念和技術的員工，逐步鍛鍊成長爲企業所需的管理人才。 要求 外界高標準要求 雖然儲備幹部能得到較多學習資源與升遷機會，但並非如外界想像的，是“搭着直升機上升”，儲備幹部等於是將原本需要花好幾年才能學會的東西，壓縮到訓練期間完成，他們面對的壓力與挑戰比一般職員高。例如這種說法是經常見的“有很多挑戰，是你平平順順走不需要遇到的。同事會覺得你做好是應該，做不好要吊起來打。” 放下面子從頭學起 多數的儲備幹部訓練，都有基層實習的部分，讓儲備幹部熟悉公司的實際運作，但有些工作瑣碎、低階，往往讓原本設定自己要坐辦公桌的儲備幹部難以調適。 別人的詫異眼光與自我對工作落差的認知，就成了儲備幹部必須要有的心理調適。 IKEA創辦人英格瓦 坎普拉在《四海一家IKEA》書中，有這麼一段話：“讓我們繼續當一羣樂觀的瘋子，一羣頑固、堅持、拒絕接受“不可能”爲答案的。 選擇儲備幹部的人當然不是瘋子，事實上他們需要更多的毅力，一種追求卓越的偏執，和接受挑戰的勇氣，最後才能度過重重關卡領取桂冠，開展另一段精采旅途。 時間 這取決於公司的培養計劃和個人的實際表現，一般零售企業的培養計劃在一到兩年左右。如果員工在入職前就具有相關的從業經驗，或者在培訓期間表現卓越，那麼就很有可能縮短培訓期。以Tesco Express爲例，公司對不同的層級發展均有完善的培訓體制。有針對內部員工的計劃，有針對應屆生的計劃。 技能 在儲備店長培訓期間，可以具體學到哪些東西？以Tesco樂購的Express便利店爲例，分爲三個階段。第一階段是體驗員工的工作，用來熟悉各個崗位的員工工作職能，包括收銀、理貨、排面陳列、倉庫整理、牌價卡打印、賣場清潔、商品促銷及清倉等。第二階段是體驗庫存管理員的工作，用來學習訂貨，盤點，庫存更正等。第三階段是體驗值班長的工作，用來學習金庫管理，開店和關店流程，員工管理，排班等。在值班長工作完成良好的情況下，會安排其進行店長工作的鍛鍊，從而晉升店長。
